{
  "schema_version": "1.0",
  "kind": "handoff",
  "id": "synthetic-example",
  "task_id": "TASK-001",
  "attempt_id": "synthetic-example",
  "branch": "synthetic-example",
  "base_oid": "aaaaaaaaaaaaaaaaaaaaaaaaaaaaaaaaaaaaaaaa",
  "commit_oid": "aaaaaaaaaaaaaaaaaaaaaaaaaaaaaaaaaaaaaaaa",
  "files_changed": [],
  "validation": [],
  "assumptions": [],
  "remaining_risks": [],
  "deviations": [],
  "interfaces_changed": [],
  "dependency_notes": [],
  "reviewer_notes": [],
  "command_evidence_refs": [],
  "context_digest": "bbbbbbbbbbbbbbbbbbbbbbbbbbbbbbbbbbbbbbbbbbbbbbbbbbbbbbbbbbbbbbbb"
}
